{
  "schema": "verification-report/v1",
  "id": "VR-axon-REDACTED-0002",
  "thread": "thread:axon-20260804-g001",
  "package": {
    "id": "DP-axon-REDACTED-0002",
    "aggregate_digest": "sha256:ee08560fb4eb722231a3374c6b4a7bc27f645aa7fee851e7a03085117330f97e"
  },
  "contract": "XC-axon-goldenexport@1.0.0#sha256:f5678dc75bcd99f7236e0aa8a139359f8df2b9242b6870c075ef0bb6799d7da4",
  "consumer": "axon",
  "checks": [
    {
      "id": "conformance:orders.json",
      "path": "orders.json",
      "status": "pass",
      "violations": []
    }
  ],
  "observed": {
    "record_count": 1,
    "size_bytes": 23,
    "duration_ms": 0
  },
  "started_at": "REDACTED-TIMESTAMP",
  "finished_at": "REDACTED-TIMESTAMP",
  "result": "pass"
}
